comment_sentence_id,class,category,category_encoded,partition,processed_text
4709,Conv3d,Summary,3,0,applies 3d convolution input signal composed several input plane simplest case output value layer input size math n c h w output math n c h w precisely described math n c j bias c j sum k 0 c 1 weight c j k star input n k attr stride control stride cross correlation attr padding control amount implicit zero padding side attr padding number point dimension attr dilation control spacing kernel point also known trous algorithm harder describe link nice visualization attr dilation attr group control connection input output attr channel attr channel must divisible attr group group 1 input convolved output group 2 operation becomes equivalent two conv layer side side seeing half input channel producing half output channel subsequently concatenated group attr channel input channel convolved set filter size math left lfloor frac channel channel right rfloor parameter attr kernel size attr stride attr padding attr dilation either single int case value used depth height width dimension tuple three ints case first int used depth dimension second int height dimension third int width dimension word input size math n c h w math channel c channel c time k args channel int number channel input image channel int number channel produced convolution kernel size int tuple size convolving kernel stride int tuple optional stride convolution default 1 padding int tuple optional zero padding added three side input default 0 padding mode string optional accepted value zero circular default zero dilation int tuple optional spacing kernel element default 1 group int optional number blocked connection input channel output channel default 1 bias bool optional true add learnable bias output default true input math n c h w output math n c h w math math math attribute weight tensor learnable weight module shape value weight sampled math k frac 1 c text prod 0 2 text kernel size bias tensor learnable bias module shape channel attr bias true value weight sampled math mathcal u sqrt k sqrt k math k frac 1 c text prod 0 2 text kernel size example square kernel equal stride nn conv3d 16 33 3 stride 2 non square kernel unequal stride padding nn conv3d 16 33 3 5 2 stride 2 1 1 padding 4 2 0 input torch randn 20 16 10 50 100 output input
4870,ConvReLU3d,Summary,3,0,convrelu3d module fused module conv3d relu adopt interface class torch nn quantized conv3d note attribute torch nn quantized conv3d
2540,ConvertingTuple,Summary,3,0,converting tuple wrapper
2542,CookieConflictError,Summary,3,0,two cooky meet criterion specified cookie jar use get set include domain path args order specific
300,CryptPasswordHasher,Summary,3,1,password hashing using unix crypt recommended crypt module supported platform
304,CustomArticleAdmin,Summary,3,0,test various hook using custom template context
306,CustomCacheKeyValidationTests,Summary,3,0,test ability mixin custom validate key method custom cache backend otherwise inherits builtin backend override default key validation
314,CustomHeaderRemoteUserTest,Parameters,2,0,test custom remoteusermiddleware subclass custom http auth user
314,CustomHeaderRemoteUserTest,Summary,3,0,test custom remoteusermiddleware subclass custom http auth user
4883,CyclicLR,Summary,3,1,set learning rate parameter group according cyclical learning rate policy clr policy cycle learning rate two boundary constant frequency detailed paper cyclical learning rate training neural network distance two boundary scaled per iteration per cycle basis cyclical learning rate policy change learning rate every batch triangular basic triangular cycle without amplitude scaling triangular2 basic triangular cycle scale initial amplitude half cycle exp range cycle scale initial amplitude math text gamma text cycle iteration cycle iteration example optimizer torch optim sgd model parameter lr 01 momentum 09 scheduler torch optim lr scheduler cycliclr optimizer base lr 001 max lr 01 data loader torch utils data dataloader epoch range 10 batch data loader train batch scheduler step
1838,CythonCommand,Summary,3,0,custom distutils command subclassed cython distutils build ext compile pyx c stop
1844,DataIndexableCol,Summary,3,0,represent data column indexed
2546,DataViewSequence,Summary,3,0,sequence data view entry instance item class
318,DatabaseReceiver,Summary,3,0,used test database argument signal 13552
2550,Date,Summary,3,0,date literal
321,DblFromGeom,Parameters,2,0,reference last argument
5005,DeQuantStub,Expand,1,0,dequantize stub module calibration identity swapped nnq dequantize convert
5005,DeQuantStub,Summary,3,1,dequantize stub module calibration identity swapped nnq dequantize convert
5011,DiagonalTensor,Summary,3,0,class torch function specific diagonal representation class limited utility mostly useful verifying dispatch mechanism work expected based diagonalarray example numpy documentation pytorch dispatch system happens via torch function diagonaltensor represents 2d tensor n row column diagonal entry set value entry set zero main functionality diagonaltensor provide compact
2555,DirectedGraph,Summary,3,0,graph structure directed edge
325,DisallowedModelAdminToField,Summary,3,0,invalid field passed admin view via url query string
1048,DisplayHook,Summary,3,0,custom ipython displayhook replace sys displayhook class many thing basic idea callable get called anytime user code return value
2557,Distribution,Summary,3,0,base class distribution whether installed index either way must metadata needed construction
327,DjangoHTMLTranslator,Summary,3,0,django specific rest html tweak
2563,DocumentErrorTree,Summary,3,1,implement dict like class query error index following
1054,DummyMod,Summary,3,0,dummy module used ipython interactive module namespace must assigned module dict
329,Dumpdata,Summary,3,1,test dumpdata management command
2806,EOF,Summary,3,0,usually mean child exited
331,EarliestOrLatestTests,Summary,3,0,test earliest latest object method
5053,EmbeddingBag,Summary,3,0,computes sum mean bag embeddings without instantiating intermediate embeddings bag constant length attr per sample weight class mode sum equivalent class torch nn embedding followed torch sum dim 0 mode mean equivalent class torch nn embedding followed torch mean dim 0 mode max equivalent class torch nn embedding followed torch max dim 0 however class torch nn embeddingbag much time memory efficient using chain operation embeddingbag also support per sample weight argument forward pas scale output embedding performing weighted reduction specified mode attr per sample weight passed supported mode sum computes weighted sum according attr per sample weight args num embeddings int size dictionary embeddings embedding dim int size embedding vector max norm float optional given embedding vector norm larger attr max norm renormalized norm attr max norm norm type float optional p p norm compute attr max norm option default 2 scale grad freq boolean optional given scale gradient inverse frequency word mini batch default false mode string optional sum mean max specifies way reduce bag sum computes weighted sum taking attr per sample weight consideration mean computes average value bag max computes max value bag default mean sparse bool optional true gradient w r attr weight matrix sparse tensor see note detail regarding sparse gradient note option supported mode max attribute weight tensor learnable weight module shape num embeddings embedding dim initialized math mathcal n 0 1 input attr input longtensor attr offset longtensor optional attr per index weight tensor optional attr input 2d shape b n treated b bag sequence fixed length n return b value aggregated way depending attr mode attr offset ignored required none case attr input 1d shape n treated concatenation multiple bag sequence attr offset required 1d tensor containing starting index position bag attr input therefore attr offset shape b attr input viewed b bag empty bag ie 0 length returned vector filled zero per sample weight tensor optional tensor float double weight none indicate weight taken 1 specified attr per sample weight must exactly shape input treated attr offset none supported mode sum example embedding module containing 10 tensor size 3 embedding sum nn embeddingbag 10 3 mode sum batch 2 sample 4 index input torch longtensor 1 2 4 5 4 3 2 9 offset torch longtensor 0 4 embedding sum input offset tensor 08861 54350 00523 11306 25798 10044
1438,EncryptedIntDict,Summary,3,0,encrypteddict deal signed 64 bit int value also add working key function
1442,EncryptedUnicodeDict,Summary,3,0,encrypteddict deal unicode value
5196,EnforceUnique,Summary,3,0,raise error key seen
2568,Environment,Expand,1,1,contains important shared variable like configuration filter test globals others instance class may modified shared template loaded far modification environment first template loaded lead surprising effect undefined behavior possible initialization parameter block start string string marking beginning block default block end string string marking end block default variable start string string marking beginning print statement default variable end string string marking end print statement default comment start string string marking beginning comment comment end string string marking end comment line statement prefix given string used prefix line based statement see also ref line statement line comment prefix given string used prefix line based comment see also ref line statement versionadded 22 trim block set true first newline block removed block variable tag lstrip block set true leading space tab stripped start line block newline sequence sequence start newline must one r n r n default n useful default linux o x system well web application keep trailing newline preserve trailing newline rendering template default false cause single newline present stripped end template versionadded 27 extension either import path string extension class information optimized optimizer enabled default true undefined finalize callable used process result variable expression output example one convert none implicitly empty string autoescape set true xml html autoescaping feature enabled default detail autoescaping see class jinja2 utils markup jinja 24 also callable passed template name versionchanged 24 loader cache size size cache per default 400 mean least recently used template 1 cache cleaned versionchanged 28 auto reload source may change ie file system database reload template higher performance possible disable bytecode cache cache internal jinja bytecode template enable async take advantage newer python feature requires python 36 later
5198,Error,Summary,3,0,error section output cuda memcheck error report error message backtrace
337,ErrorDict,Summary,3,0,collection error know display various format dictionary key field name value error
1444,Event,Summary,3,0,single event event log actual interpretation rendering event handled respective source class
1846,ExcelFile,Summary,3,0,class parsing tabular excel sheet dataframe object us xlrd see read excel documentation parameter io str path object pathlib path py path local localpath file like object xlrd workbook openpypl workbook string path object expected path xl xlsx odf file engine str default none io buffer path must set identify io acceptable value none xlrd openpyxl odf note odf read table opendocument formatted file
2808,ExceptionPexpect,Summary,3,0,base class exception raised module
341,ExceptionThatFailsUnpickling,Summary,3,0,pickling class fails unpickling error incorrect argument passed init
5209,ExceptionWrapper,Summary,3,0,wrap exception plus traceback communicate across thread
5211,ExternalInitializer,Usage,4,1,class used case parameter initialized initializer rather provided workspace param init net executed current version real sanity check parameter
2810,ExtractError,Summary,3,0,general exception extract error
2812,FakeFile,Summary,3,0,wrap list line object readline make
345,FakePayload,Summary,3,0,wrapper around bytesio restricts read since data network sought cannot read outside content length make sure view anything test client work real life
355,FallbackStorage,Expand,1,0,try store message first backend store unstored message subsequent backend
2824,FileMetadata,Expand,1,0,metadata handler standalone pkg info file usage metadata filemetadata path pkg info provider reject data metadata request except pkg info treated existing content file provided location metadata handler standalone pkg info file usage metadata filemetadata path pkg info provider reject data metadata request except pkg info treated existing content file provided location
2824,FileMetadata,Summary,3,1,metadata handler standalone pkg info file usage metadata filemetadata path pkg info provider reject data metadata request except pkg info treated existing content file provided location metadata handler standalone pkg info file usage metadata filemetadata path pkg info provider reject data metadata request except pkg info treated existing content file provided location
2848,FileSystemLoader,Summary,3,0,load template file system loader find template folder file system preferred way load loader take path template string multiple location wanted list looked given order loader filesystemloader path template per default template encoding utf 8 changed setting encoding parameter something else follow symbolic link set followlinks parameter true loader filesystemloader path template followlinks true
2873,Filter,Summary,3,1,alphabetizes attribute element
2875,Filter_,Summary,3,1,sanitizes token stream xhtml mathml svg inline style attribute
5219,FisherSnedecor,Summary,3,0,creates fisher snedecor distribution parameterized attr df1 attr df2 example fishersnedecor torch tensor 10 torch tensor 20 sample fisher snedecor distributed df1 1 df2 2 tensor 02453 args df1 float tensor degree freedom parameter 1 df2 float tensor degree freedom parameter 2
2877,FollowedBy,Summary,3,0,lookahead matching given parse expression followedby advance parsing position within input string verifies specified parse expression match current position followedby always return null token list result name defined lookahead expression returned access name example use followedby match label followed data word word alpha label data word followedby attr expr group label suppress oneormore data word stopon label setparseaction join oneormore attr expr parsestring shape square color black posn upper left pprint print shape square color black posn upper left
361,FootNote,DevelopmentNotes,0,0,model added ticket 19838
1450,Forward,Summary,3,0,create forwarding draft one message
363,FrenchTestCase,Summary,3,0,test using french translation sampleproject
371,GZipMiddleware,Summary,3,0,accept encoding header
1058,GeoJSON,Summary,3,0,geojson expects json able dict already serialized json string scalar type none number string allowed dict container
2927,Getattr,Usage,4,0,get attribute item expression ascii bytestring prefer attribute
367,Group,Summary,3,0,table column field
1452,Group_,Summary,3,0,view group
2999,HTMLParser,Summary,3,0,html parser generates tree structure stream possibly malformed html
3003,HTTPError,Summary,3,0,http error occurred
1454,HashCash,Summary,3,0,try collide hash using smtorp algorithm
2931,HashMissing,Summary,3,1,hash needed requirement absent
2936,HebrewProber,DevelopmentNotes,0,0,two sbcharsetprobers identify text fact kind hebrew logical visual score two sbcharsetprobers produce final answer reduces sequence character single space built hebrewprober using language model disjointed model probers result hebrewprober alone meaningless
1064,HelpEnd,Summary,3,0,transformer help syntax obj obj
374,HiddenRangeWidget,Summary,3,0,widget split input two input type hidden input
1068,HistoryAccessor,Summary,3,0,access history database without adding intended use standalone history tool ipython shell use historymanager subclass
1870,Holiday,Summary,3,0,class defines holiday start end date rule observance
1095,IPythonInputSplitter,Summary,3,1,input splitter recognizes ipython special syntax
376,ImageFileDescriptor,Summary,3,0,like filedescriptor imagefields difference assigning width height width field height field appropriate
382,IncompleteCategoryFormWithExclude,Summary,3,0,form replaces model url field custom one
386,Individual,Summary,3,0,model fk registered admin corresponding raw id widget magnifying glass link select related instance rendering called programmatically case
397,InputStreamExhausted,Expand,1,0,read allowed device
397,InputStreamExhausted,Summary,3,0,read allowed device
3006,InsecurePlatformWarning,Summary,3,0,warned certain ssl configuration available platform
3008,InspectedValidator,Summary,3,0,metaclass validators
3012,InstalledDistribution,Usage,4,0,read metadata contained pydist json instantiated us passed metadata instance useful dry run mode used
400,IntFromGeom,DevelopmentNotes,0,1,argument geometry return type integer
400,IntFromGeom,Parameters,2,1,argument geometry return type integer
1874,IntegerArray,Summary,3,0,array integer optional missing value integerarray currently experimental api internal represent integerarray 2 numpy array data contains numpy integer array appropriate dtype mask boolean array holding mask data true missing construct integerarray generic array like input use func panda array one integer dtypes see example parameter value numpy ndarray 1 integer dtype array mask numpy ndarray 1 boolean dtype array indicating missing value copy bool default false whether copy value mask attribute none method none return integerarray example create integerarray func panda array int array pd array 1 none 3 dtype pd int32dtype int array integerarray 1 nan 3 length 3 dtype int32 string alias dtypes also available capitalized pd array 1 none 3 dtype int32 integerarray 1 nan 3 length 3 dtype int32 pd array 1 none 3 dtype uint16 integerarray 1 nan 3 length 3 dtype uint16
1078,InteractiveShellApp,Summary,3,0,part configuring shell environment following method called meth initialize method subclass meth init path meth init shell implemented subclass meth init gui pylab meth init extension meth init code
3019,InternalName,Summary,3,0,internal name compiler cannot create node parser provides meth jinja2 parser parser free identifier method creates new identifier identifier available template threated specially compiler
1958,IntervalDtype,Summary,3,0,extensiondtype interval data actual numpy dtype duck type parameter subtype str np dtype dtype interval bound attribute subtype method none example pd intervaldtype subtype int64 interval int64
403,InvalidBasesError,Summary,3,0,model base class resolved
3033,InvalidDateError,Summary,3,0,date field improperly specified
5931,InvalidHeader,Summary,3,1,header value provided somehow invalid
3035,InvalidHeaderError,Summary,3,0,exception invalid header
3037,InvalidVersion,Summary,3,0,invalid version found user refer pep 440
3037,InvalidVersion,Usage,4,0,invalid version found user refer pep 440
405,KMLSitemap,Summary,3,0,minimal hook produce kml sitemaps
3040,Kanji,Summary,3,0,unicode set kanji unicode character range
3042,Katakana,Summary,3,0,unicode set katakana unicode character range
3044,KeyType,Summary,3,0,type key key bare unquoted quoted using basic literal quote following escaping rule single line stringtype
5243,LBFGS,Summary,3,0,implement l bfgs algorithm heavily inspired minfunc note memory intensive optimizer requires additional param byte history size 1 byte fit memory try reducing history size use different algorithm argument lr float learning rate default 1 max iter int maximal number iteration per optimization step default 20 max eval int maximal number function evaluation per optimization step default max iter 125 tolerance grad float termination tolerance first order optimality default 1e 5 tolerance change float termination tolerance function value parameter change default 1e 9 history size int update history size default 100 line search fn str either strong wolfe none default none
3062,LRUCache,Summary,3,0,simple lru cache implementation fast small capacity something 1000 scale long used storage template harm
5235,LastNWindowCollector,Summary,3,0,collect last n sample input record complex data use packrecords pack using layer layer thread safe
1097,LazyEvaluate,DevelopmentNotes,0,0,used formatting string value need updated time current time working directory
407,ListMixin,Summary,3,0,base class provides complete list interface derived class must call listmixin init function implement following function get single external self return single item index general use index always satisfy 0 len self function get single internal self use within class optional note get single internal get single internal return different type object set list must distinguish two handle appropriately function set list self length item recreate entire object note item may generator call get single internal therefore necessary cache value temporary temp list item clobbering original storage function set single self value set single item index value optional left undefined mutation result rebuilding object using set list function len self return length int minlength minimum legal length optional int maxlength maximum legal length optional type tuple allowed type tuple allowed item type optional
1456,ListTags,Summary,3,0,list tag
3052,LockFailed,Summary,3,0,lock file creation failed reason try raise lockfailed except lockerror pas
465,LogoutThenLoginTests,Summary,3,0,test logout login view
1101,Magics,Summary,3,1,base class implementing magic function shell function reached function name make function easier type eg cd v cd class providing magic function need subclass class must use method decorator line magic cell magic decorate individual method magic function use class decorator magic class ensure magic method properly registered instance level upon instance initialization
1458,MailpileJinjaLoader,Summary,3,0,jinja2 template loader us mailpile configuration plugin system find template file
1462,MailpileMailbox,Summary,3,0,maildir class window using instead filename
1466,MailpileVFS,Summary,3,0,router object implement vfs interface delegating call individual implementation
467,MakeListTests,Expand,1,0,make list filter destroy existing escaping result escaped
471,ManagementForm,Summary,3,0,keep track many form instance displayed page
3072,Markup,Summary,3,0,string ready safely inserted html xml document either escaped marked safe passing object constructor convert text wrap mark safe without escaping escape text use meth escape class method instead markup hello em world em markup hello em world em markup 42 markup 42 markup escape hello em world em markup hello lt em gt world lt em gt implement html interface framework use passing object implement html wrap output method marking safe class foo def html self return href foo foo markup foo markup href foo foo subclass text type str python 3 unicode python 2 method type method escape argument return markup instance markup em em foo bar markup em foo amp bar em markup em hello em foo markup em hello em lt foo gt
3161,MemcachedBytecodeCache,Summary,3,0,class implement bytecode cache us memcache cache storing information enforce specific memcache library tummy memcache cmemcache accept class provides minimal interface required minimal interface client passed constructor class minimalclientinterface method set key value timeout store bytecode cache value string timeout timeout key timeout provided default timeout timeout assumed provided integer number second cache item exist method get key return value cache key item exist cache return value must none argument constructor prefix key added actual cache key timeout bytecode cache system recommend high timeout
476,MemcachedCache,Summary,3,0,implementation cache binding using python memcached
3222,MemoizedZipManifests,Summary,3,0,memoized zipfile manifest
478,MemoryFileUploadHandler,Summary,3,0,file upload handler stream uploads memory used small file
3224,MetadataMissingError,Summary,3,0,required metadata missing
3226,MethodDispatcher,Summary,3,0,dict 2 special property initiation key list set tuples converted multiple key accessing one item original list like object return matching value default value set default attribute
480,Migration,Summary,3,0,base class migration one following attribute operation list operation instance probably django db migration operation dependency list tuples app path migration name run list tuples app path migration name replaces list migration name
504,MigrationGraph,Summary,3,0,represent digraph migration project migration node dependency edge implicit dependency numbered migration numbering merely convention aid file listing migration file marked replacing another set migration support squash feature graph handler responsible instead code load examine migration file replaced migration either unapplied present ignore replaced one load replacing migration repoint dependency pointed replaced migration point replacing one node tuple app path migration name
538,MigrationLoader,Summary,3,1,load migration file disk status database initialization class scan directory open read python file looking class called migration inherit django db migration migration see django db migration migration look like migration marked replacing another set migration loaded separate set migration away main one migration replace either unapplied missing disk injected main set replacing named migration dependency pointer replaced migration pointed new migration mean class must also talk database well disk probably fine already operating memory
574,MigrationQuestioner,Summary,3,1,give autodetector response question might base class built noninteractive mode interactive subclass command line argument use
