comment_sentence_id,class,category,category_encoded,partition,processed_text
582,MigrationWriter,Summary,3,1,take migration instance able produce content migration file
586,ModelBase,Summary,3,1,metaclass model
588,ModelSignal,Summary,3,1,signal subclass allows sender lazily specified string app label modelname form
5287,Module,Summary,3,1,base class neural network module module also contain module allowing nest tree structure assign submodules regular attribute import torch nn nn import torch nn functional f class model nn module def init self super model self init self conv1 nn conv2d 1 20 5 self conv2 nn conv2d 20 20 5 def forward self x x f relu self conv1 x return f relu self conv2 x submodules assigned way registered parameter converted call meth etc
3240,Module_six_moves_urllib_parse,Summary,3,0,lazy loading moved object six move urllib parse
3242,Module_six_moves_urllib_request,Summary,3,0,lazy loading moved object six move urllib request
3244,Module_six_moves_urllib_response,Summary,3,0,lazy loading moved object six move urllib response
1470,MoveFilter,Summary,3,0,move auto tagging rule
3246,Mul,Summary,3,0,multiplies left right node
5322,MultiLabelMarginLoss,Summary,3,0,creates criterion optimizes multi class multi classification hinge loss margin based loss input math x 2d mini batch tensor output math 2d tensor target class index sample mini batch math text loss x sum ij frac max 0 1 x j x text x size 0 criterion considers contiguous block non negative target start front allows different sample variable amount target class args size average bool optional deprecated see attr reduction default loss averaged loss element batch note loss multiple element per sample field attr size average set false loss instead summed minibatch ignored reduce false default true reduce bool optional deprecated see attr reduction loss averaged summed observation minibatch depending attr size average attr reduce false return loss per batch element instead ignores attr size average default true reduction string optional specifies reduction apply output none mean sum none reduction applied mean sum output divided number element output sum output summed note attr size average attr reduce process deprecated meantime default mean input math c math n c n batch size c target math c math n c label target padded 1 ensuring shape input attr reduction none math n example loss nn multilabelmarginloss x torch floattensor 01 02 04 08 target consider label 3 0 label 1 torch longtensor 3 0 1 1 loss x 025 1 01 02 1 01 04 1 08 02 1 08 04 tensor 08500
592,MultiPartParser,Summary,3,1,rfc2388 multipart form data parser multivaluedict parse read input stream chunk size chunk return tuple multivaluedict post multivaluedict file
598,MultiValueDict,Summary,3,0,subclass dictionary customized handle multiple value key multivaluedict name adrian simon position developer name simon getlist name getlist doesnotexist get lastname nonexistent nonexistent setlist lastname holovaty willison class exists solve irritating problem raised cgi parse q return list every key even though web form submit single name value pair
633,MultiValueField,Summary,3,0,aggregate logic multiple field clean method take decompressed list value cleaned single value according self field value list cleaned corresponding field first value cleaned first field second value cleaned second field etc field cleaned list clean value compressed single value
654,MultiWidget,Summary,3,0,widget composed multiple widget addition value added widget get context widget add list subwidgets context widget subwidgets looped rendered like normal widget
1132,MyFrame,Summary,3,0,myframe show control wxpanel simple menu
663,MyModel,Summary,3,0,model subclass custom base using metaclass
3248,NativeEnvironment,Summary,3,0,environment render template native python type
665,NestedObjectsTests,Summary,3,0,test nestedobject utility collection
5426,NetModifier,Summary,3,1,abstraction class supporting modifying generated net inherited class implement modify net method related operator added net example usage modifier somenetmodifier opts modifier net
3252,NoMatch,Summary,3,0,token never match
3250,Node,Summary,3,0,represents item tree
1982,NonConsolidatableMixIn,Summary,3,0,hold method nonconsolidatable block
3254,NotAny,Summary,3,0,lookahead disallow matching given parse expression notany advance parsing position within input string verifies specified parse expression match current position also notany skip leading whitespace notany always return null token list may constructed using operator example map caselesskeyword split take care mistake keywords identifier ident word alpha boolean term optional ident crude boolean expression support parenthesis group operation hierarchy use infixnotation boolean expr boolean term zeroormore boolean term integer followed actually float integer word nums char
3294,NotMyLock,Summary,3,0,raised attempt made unlock file someone else locked try raise notmylock except unlockerror pas
1138,Obj,Summary,3,0,namespace hold arbitrary information
1472,OldPostingList,Summary,3,0,posting list map search term message id
5438,OneHotCategorical,Summary,3,0,creates one hot categorical distribution parameterized attr probs attr logits sample one hot coded vector size probs size 1 note attr probs must non negative finite non zero sum normalized sum 1 attr probs attr logits example onehotcategorical torch tensor 025 025 025 025 sample equal probability 0 1 2 3 tensor 0 0 0 1 args probs tensor event probability logits tensor event log probability
667,Operation,Summary,3,0,base class migration operation responsible mutating memory model state see db migration state py represent performs well actually performing live database
3385,Option,Summary,3,0,option usually optional value command line extra feature argument parameter passed onwards parameter constructor param show default control default value shown help page normally default shown value string show string instead value particularly useful dynamic option param show envvar control environment variable shown normally environment variable shown param prompt set true non empty string user prompted input set true prompt option name capitalized param confirmation prompt set value need confirmed prompted hidden user useful password input param flag force option act flag default auto detection param flag value value used flag enabled set boolean automatically option string contains slash mark two option param multiple set true argument accepted multiple time recorded similar nargs work support arbitrary number argument param count flag make option increment integer param allow autoenv enabled value parameter pulled environment variable case prefix defined context param help help string param hidden hide option help output
680,OverwritingStorage,Summary,3,0,overwrite existing file instead appending suffix generate unused name
3471,PacifyFlushWrapper,Expand,1,0,wrapper used catch suppress brokenpipeerrors resulting flush called broken pipe shutdown final gc python interpreter notably flush always called sys stdout sys stderr minimal impact cleanup code case underlying file broken pipe call attribute proxied
3471,PacifyFlushWrapper,Summary,3,0,wrapper used catch suppress brokenpipeerrors resulting flush called broken pipe shutdown final gc python interpreter notably flush always called sys stdout sys stderr minimal impact cleanup code case underlying file broken pipe call attribute proxied
3490,PackageIndex,Summary,3,0,represents package index provides easier access endpoint
685,ParentWithDependentChildren,Summary,3,0,model validation child foreign key relationship depends validation parent
3492,ParseError,Summary,3,0,error occurs parser encounter syntax error toml parsed
3499,ParseFatalException,DevelopmentNotes,0,1,user throwable exception thrown inconsistent parse content found stop parsing immediately
3505,ParseResultBytes,Summary,3,0,compatibility shim urlparse parseresultbytes object
3507,ParseResults,Summary,3,0,structured parse result provide multiple mean access parsed data list len result list index result 0 result 1 etc attribute result resultsname see class parserelement setresultsname example integer word nums date str integer setresultsname year integer setresultsname month integer setresultsname day equivalent form date str integer year integer month integer day parsestring return parseresults object result date str parsestring 1999 12 31 def test fn repr print fn eval test list result test result 0 test result month test result day test month result test minute result test result dump str print list result 1999 12 31 result 0 1999 result month 12 result day 31 month result true minute result false result dump 1999 12 31 day 31 month 12 year 1999
3503,ParserElement,Summary,3,0,abstract base level parser element class
3601,Path,Parameters,2,1,path type similar class file type performs different check first instead returning open file handle return filename secondly perform various basic check file directory param exists set true file directory need exist value valid required file indeed exist check silently skipped param file okay control file possible value param dir okay control directory possible value param readable true readable check performed param resolve path true path fully resolved value passed onwards mean expand tilde prefix supposed done shell param allow dash set true single dash indicate param path type optionally string type used represent path default none unicode depending make sense given
3601,Path,Summary,3,1,path type similar class file type performs different check first instead returning open file handle return filename secondly perform various basic check file directory param exists set true file directory need exist value valid required file indeed exist check silently skipped param file okay control file possible value param dir okay control directory possible value param readable true readable check performed param resolve path true path fully resolved value passed onwards mean expand tilde prefix supposed done shell param allow dash set true single dash indicate param path type optionally string type used represent path default none unicode depending make sense given
689,Permission,Summary,3,0,permission system provides way assign permission specific user group user permission system used django admin site may also useful code django admin site us permission follows add permission limit user ability view add form add object change permission limit user ability view change list view change form change object delete permission limit ability delete object view permission limit ability view object permission listed automatically created model
3663,PipError,Summary,3,1,base pip exception
1984,PlotAccessor,Parameters,2,0,make plot series dataframe us backend specified option plotting backend default matplotlib used parameter data series dataframe object method called x label position default none used data dataframe label position list label position default none allows plotting one column versus another used data dataframe kind str kind plot produce line line plot default bar vertical bar plot barh horizontal bar plot hist histogram box boxplot kde kernel density estimation plot density kde area area plot pie pie plot scatter scatter plot hexbin hexbin plot figsize tuple width height inch use index bool default true use index tick x axis title str list title use plot string passed print string top figure list passed subplots true print item list corresponding subplot grid bool default none matlab style default axis grid line legend bool reverse place legend axis subplots style list dict matplotlib line style per column logx bool sym default false use log scaling symlog scaling x axis versionchanged 025 0 logy bool sym default false use log scaling symlog scaling axis versionchanged 025 0 loglog bool sym default false use log scaling symlog scaling x ax versionchanged 025 0 xticks sequence value use xticks yticks sequence value use yticks xlim 2 tuple list ylim 2 tuple list rot int default none rotation tick xticks vertical yticks horizontal plot fontsize int default none font size xticks yticks colormap str matplotlib colormap object default none colormap select color string load colormap name matplotlib colorbar bool optional true plot colorbar relevant scatter hexbin plot position float specify relative alignment bar plot layout 0 left bottom end 1 right top end default 05 center table bool series dataframe default false true draw table using data dataframe data transposed meet matplotlib default layout series dataframe passed use passed data draw table yerr dataframe series array like dict str see ref plotting error bar visualization errorbars detail xerr dataframe series array like dict str equivalent yerr mark right bool default true using secondary axis automatically mark column label right legend include bool bool default false true boolean value plotted backend str default none backend use instead backend specified option plotting backend instance matplotlib alternatively specify plotting backend whole session set versionadded 10 0 kwargs option pas matplotlib plotting method return class matplotlib ax ax numpy ndarray backend default matplotlib one return value object returned backend note see matplotlib documentation online subject kind bar barh specify relative alignment bar plot layout position keyword 0 left bottom end 1 right top end default 05 center
1984,PlotAccessor,Summary,3,0,make plot series dataframe us backend specified option plotting backend default matplotlib used parameter data series dataframe object method called x label position default none used data dataframe label position list label position default none allows plotting one column versus another used data dataframe kind str kind plot produce line line plot default bar vertical bar plot barh horizontal bar plot hist histogram box boxplot kde kernel density estimation plot density kde area area plot pie pie plot scatter scatter plot hexbin hexbin plot figsize tuple width height inch use index bool default true use index tick x axis title str list title use plot string passed print string top figure list passed subplots true print item list corresponding subplot grid bool default none matlab style default axis grid line legend bool reverse place legend axis subplots style list dict matplotlib line style per column logx bool sym default false use log scaling symlog scaling x axis versionchanged 025 0 logy bool sym default false use log scaling symlog scaling axis versionchanged 025 0 loglog bool sym default false use log scaling symlog scaling x ax versionchanged 025 0 xticks sequence value use xticks yticks sequence value use yticks xlim 2 tuple list ylim 2 tuple list rot int default none rotation tick xticks vertical yticks horizontal plot fontsize int default none font size xticks yticks colormap str matplotlib colormap object default none colormap select color string load colormap name matplotlib colorbar bool optional true plot colorbar relevant scatter hexbin plot position float specify relative alignment bar plot layout 0 left bottom end 1 right top end default 05 center table bool series dataframe default false true draw table using data dataframe data transposed meet matplotlib default layout series dataframe passed use passed data draw table yerr dataframe series array like dict str see ref plotting error bar visualization errorbars detail xerr dataframe series array like dict str equivalent yerr mark right bool default true using secondary axis automatically mark column label right legend include bool bool default false true boolean value plotted backend str default none backend use instead backend specified option plotting backend instance matplotlib alternatively specify plotting backend whole session set versionadded 10 0 kwargs option pas matplotlib plotting method return class matplotlib ax ax numpy ndarray backend default matplotlib one return value object returned backend note see matplotlib documentation online subject kind bar barh specify relative alignment bar plot layout position keyword 0 left bottom end 1 right top end default 05 center
5464,Poisson,Summary,3,0,creates poisson distribution parameterized attr rate rate parameter sample nonnegative integer pmf given math example poisson torch tensor 4 sample tensor 3 args rate number tensor rate parameter
3665,PoolManager,Summary,3,0,allows arbitrary request transparently keeping track necessary connection pool param num pool number connection pool cache discarding least recently used pool param header header include request unless header given explicitly param connection pool kw additional parameter used create fresh class urllib3 connectionpool connectionpool instance example manager poolmanager num pool 2 r manager request get http google com r manager request get http yahoo com len manager pool
3699,PrefixLoader,Summary,3,0,loader passed dict loader loader bound prefix prefix delimited template slash per default changed setting delimiter argument something else loader prefixloader app1 packageloader mypackage app1 app2 packageloader mypackage app2 loading app1 index html file app1 package loaded loading app2 index html file second
5933,PreparedRequest,Summary,3,0,fully mutable class preparedrequest preparedrequest object containing exact byte sent server generated either class request request object manually usage import request req request request get http httpbin org get r req prepare r preparedrequest get request session send r response 200
3722,ProcessedTraceback,Summary,3,0,hold jinja preprocessed traceback printing reraising
723,ProxyModelInheritanceTests,Summary,3,0,proxy model inheritance across apps result migrate creating table proxied model described 12286 test creates two dummy apps call migrate verifies table created
3724,PyPIJSONLocator,Expand,1,0,locator us pypi json interface
5487,QuantWrapper,Summary,3,0,wrapper class wrap input module add quantstub dequantstub surround call module call quant dequant module used quantization utility function add quant dequant module convert function quantstub observer observes input tensor convert quantstub swapped nnq quantize actual quantization similarly dequantstub
731,RawPostDataException,Summary,3,0,cannot access raw post data request multipart post data accessed via post file etc
3728,ReadError,Summary,3,0,raised archive cannot read
742,RemoteTestRunner,Summary,3,0,run test record everything display anything
3730,Request,Summary,3,0,user created class request request object used prepare class preparedrequest preparedrequest sent server param method http method use param url url send param header dictionary header send param file dictionary filename fileobject file multipart upload param data body attach request dictionary list tuples key value provided form encoding take place param json json body attach request file data specified param params url parameter append url dictionary list tuples key value provided form encoding take place param auth auth handler user pas tuple param cooky dictionary cookiejar cooky attach request param hook dictionary callback hook internal usage usage import request req request request get http httpbin org get req prepare preparedrequest get
745,RequestFactoryEnvironmentTests,Expand,1,0,regression test 8551 17067 ensure environment variable set correctly requestfactory
745,RequestFactoryEnvironmentTests,Summary,3,0,regression test 8551 17067 ensure environment variable set correctly requestfactory
3780,RequirementUninstaller,Summary,3,0,context manager remove package inner block us uninstallpathset control workflow inner block exit correctly uninstallation committed otherwise rolled back
3778,RequirementsFileParseError,Summary,3,0,raised general error occurs parsing requirement file line
3788,RequiresPythonCache,Summary,3,0,cache candidate requires python information
5505,ResNetBuilder,Summary,3,1,helper class constructing residual block
1474,Rescan,Summary,3,1,add new message index
3790,Resource,Summary,3,0,class representing package resource data file normally instantiated user code rather class resourcefinder manages resource
3798,ResourceFinder,Summary,3,0,resource finder file system resource
3800,ResourceManager,Summary,3,0,manage resource extraction package
5957,Response,Summary,3,0,class response response object contains server response http request
3802,ResponseError,Usage,4,1,used container error reason supplied maxretryerror
3804,ResponseNotChunked,Usage,4,0,response need chunked order read chunk
3806,Retry,Summary,3,0,retry configuration retry attempt create new retry object updated value safely reused retries defined default pool retries retry connect 5 read 2 redirect 5 http poolmanager retries retries response http request get http example com per request override default pool retries disabled passing false param int total total number retries allow take precedence count set none remove constraint fall back count good idea set sensibly high value account unexpected edge case avoid infinite retry loop set 0 fail first retry set false disable imply raise redirect false param int connect many connection related error retry error raised request sent remote server set 0 fail first retry type param int read many time retry read error error raised request sent server request may side effect set 0 fail first retry type param int redirect many redirects perform limit avoid infinite redirect loop redirect http response status code 301 302 303 307 308 set 0 fail first retry type set false disable imply raise redirect false param int status many time retry bad status code retries made response status code match status forcelist set 0 fail first retry type param iterable method whitelist set uppercased http method verb retry default retry method considered idempotent multiple request parameter end state see attr retry default method whitelist set false value retry verb param iterable status forcelist set integer http status code force retry retry initiated request method method whitelist default disabled none param float backoff factor backoff factor apply attempt second try error resolved immediately second try without delay urllib3 sleep backoff factor 2 number total retries 1 second backoff factor 01 func sleep sleep 00s 02s 04s retries never longer attr retry backoff max default backoff disabled set 0 param bool raise redirect whether number redirects exhausted raise maxretryerror return response response code 3xx range param bool raise status similar meaning raise redirect whether raise exception return response status fall status forcelist range retries exhausted param tuple history history request encountered call meth retry increment list order request occurred list item class class requesthistory param bool respect retry header whether respect retry header status code defined attr retry retry status code param iterable remove header redirect sequence header remove request response indicating redirect returned firing redirected request
751,ReverseGenericManyToOneDescriptor,Summary,3,0,accessor related object manager one many relation created genericrelation example class post model comment genericrelation comment post comment reversegenericmanytoonedescriptor instance
1140,RichPromptDisplayHook,Summary,3,0,subclass base display hook using coloured prompt
5507,SGD,Summary,3,0,implement stochastic gradient descent optionally momentum nesterov momentum based formula importance initialization momentum deep learning args params iterable iterable parameter optimize dicts defining parameter group lr float learning rate momentum float optional momentum factor default 0 weight decay float optional weight decay l2 penalty default 0 dampening float optional dampening momentum default 0 nesterov bool optional enables nesterov momentum default false example optimizer torch optim sgd model parameter lr 01 momentum 09 optimizer zero grad loss fn model input target backward optimizer step
2234,SQLTable,Summary,3,0,mapping panda table sql table us fact table reflected sqlalchemy better type conversion also hold various flag needed avoid pas function time
2230,SQLiteTable,Summary,3,0,patch sqltable fallback support instead table variable use create table statement
3982,SafeFileCache,Summary,3,0,file based cache safe use even target directory may accessible writable
763,SameAsLookup,Expand,1,0,operator operator test actual geometric equality two feature b feature vertex vertex operator return true
763,SameAsLookup,Summary,3,0,operator operator test actual geometric equality two feature b feature vertex vertex operator return true
3986,SchemaValidatorMixin,Summary,3,0,validator mixin provides mechanic validate schema passed cerberus validator
2210,SelectNSeries,Summary,3,0,implement n largest smallest series parameter obj series n int keep first last default first return nordered series
778,Serializer,Summary,3,0,convert queryset json
3990,Session,Summary,3,0,request session provides cookie persistence connection pooling configuration basic usage import request request session get http httpbin org get response 200 context manager request session get http httpbin org get response 200
780,SessionStorage,Summary,3,0,store message session django contrib session
782,SessionStore,Expand,1,1,database session store handle updating account id column inside custom session model
782,SessionStore,Summary,3,0,database session store handle updating account id column inside custom session model
2224,SetopCheck,DevelopmentNotes,0,0,called decorate set operation intervalindex perform type check advance
2224,SetopCheck,Summary,3,0,called decorate set operation intervalindex perform type check advance
5559,SharedCache,Summary,3,0,dictionary multiprocessing handle storageweakref
787,SimpleView,Summary,3,0,simple view docstring
