comment_sentence_id,class,category,category_encoded,partition,processed_text
4012,SkipTo,Summary,3,0,token skipping undefined text matched expression found parameter expr target expression marking end data skipped include default false true target expression also parsed skipped text target expression returned 2 element list ignore default none used define grammar typically quoted string comment might contain false match target expression failon default none define expression allowed included skipped test found target expression found skipto match example report severity description day open 101 critical intermittent system crash 6 94 cosmetic spelling error login log n 14 integer word nums sep suppress use skipto simply match everything next sep ignore quoted string character inside quoted string match parse action call token strip matched token ie description body string data skipto sep ignore quotedstring string data setparseaction tokenmap str strip ticket expr integer issue num sep string data sev sep string data desc sep integer day open print tkt dump print 101 critical intermittent system crash 6 day open 6 desc intermittent system crash issue num 101 sev critical 94 cosmetic spelling error login log n 14 day open 14 desc spelling error login log n issue num 94 sev cosmetic day open 47 issue num 79 sev minor
789,SpatialRefSysMixin,DevelopmentNotes,0,1,spatialrefsysmixin class used database dependent spatialrefsys object reduce redundant code
789,SpatialRefSysMixin,Summary,3,1,spatialrefsysmixin class used database dependent spatialrefsys object reduce redundant code
795,SplitHiddenDateTimeWidget,Summary,3,0,widget split datetime input two input type hidden input
5563,StackTransform,Summary,3,0,transform functor applies sequence transforms tseq component wise submatrix dim way compatible func torch stack example x torch stack torch range 1 10 torch range 1 10 dim 1 stacktransform exptransform identity transform dim 1 x
5561,StackedLSTMWithDropout,Summary,3,1,necessary iterating self layer dropout support
797,StaticFilesHandler,Parameters,2,0,wsgi middleware intercept call static file directory defined static url setting serf file
797,StaticFilesHandler,Summary,3,1,wsgi middleware intercept call static file directory defined static url setting serf file
1476,StorageBackedLongs,Summary,3,0,combine storagebackeddata pack unpacklonglist pack save set ints storage sbl x01 x00 x00 x00 x00 x00 x00 x00 sbl storagebackedlongs storage sbl 1 sbl true sbl append 2 sbl save unpacklonglist storage sbl 1 2 true
2245,StringArray,Summary,3,1,extension array string data warning stringarray considered experimental part api may change without warning parameter value array like array data warning currently expects object dtype ndarray element python string may copy bool default false attribute none method none string method available series backed stringarray note stringarray return booleanarray comparison method example pd array text none data dtype string stringarray text na data value traceback recent call last comparison method return class panda booleanarray pd array none c dtype string booleanarray true na false
2322,StringMethods,Summary,3,0,vectorized string function series index na stay na unless handled otherwise particular method patterned python string method inspiration r stringr package example str split str replace
1142,Struct,Expand,1,1,dict subclass attribute style access dict subclass extra feature attribute style access protection class member like key item using attribute style access ability restrict assignment existing key intelligent merging overloaded operator
1142,Struct,Summary,3,0,dict subclass attribute style access dict subclass extra feature attribute style access protection class member like key item using attribute style access ability restrict assignment existing key intelligent merging overloaded operator
5577,Subset,Summary,3,0,subset dataset specified index argument dataset dataset whole dataset index sequence index whole set selected subset
808,SuccessMessageMixin,Summary,3,0,add success message successful form submission
1158,TBTools,Summary,3,0,basic tool used traceback printer class
4106,TarFile,Summary,3,1,tarfile class provides interface tar archive
5585,Task,Summary,3,0,task composed execution step zero output task executed context taskgroup turn run session task output fetched session end run example net builder import ops node trainer task name task num instance 2 ops task init globl ops const 0 ops task instance init local ops const 0 ops loop 100 ops copy globl local ops task instance exit ops add globl local globl ops task exit ops mul globl globl globl task create 2 instance run parallel instance copy local globl 100 time add local globl mul execute instance task finished
5630,TaskOutput,Summary,3,0,represents output task
810,TemplateDoesNotExist,Summary,3,0,exception used template exist optional argument backend tried formatted list tuples containing origin status origin origin object duck type status string reason template found chain list intermediate templatedoesnotexist exception used encapsulate multiple exception loading template multiple engine
1160,TermColors,Summary,3,0,color escape sequence class defines escape sequence standard ansi color terminal also defines nocolor escape null string suitable defining dummy color scheme terminal get confused color escape class used mixin building color scheme
2338,TermValue,Summary,3,1,hold term value use construct condition filter
5635,TestBuiltins,Summary,3,1,test torchscript support python builtin function
2340,TestDatetimelikeSubtype,Summary,3,0,test specific intervalindex datetime like subtype
2342,TestFromArrays,Summary,3,0,test specific intervalindex array
2344,TestFromTuples,Summary,3,0,test specific intervalindex tuples
840,TestImageFieldFile,Summary,3,0,custom field file class record whether underlying file opened
2346,TestPeriodIndexSeriesComparisonConsistency,Summary,3,0,test periodindex period series ops consistency
5637,TestQuantizedLinear,Summary,3,1,test correctness quantized linear linear relu op
844,TestRouter,Expand,1,1,route database model name start
2349,TestSorted,Summary,3,0,everything wanted test sorting
846,TestUtils,DevelopmentNotes,0,0,doc output required testing
5639,TestYellowFin,Summary,3,1,yellowfin automatic tuner momentum sgd
4108,Token,Summary,3,0,token class
4110,TokenStreamIterator,Summary,3,1,iterator tokenstreams iterate stream eof token reached
5644,TransformerEncoderLayer,DevelopmentNotes,0,0,ashish vaswani noam shazeer niki parmar jakob uszkoreit llion jones aidan n gomez lukasz kaiser illia polosukhin 2017 attention need advance neural information processing system page 6000 6010 user may modify implement different way application args model number expected feature input required nhead number head multiheadattention model required dim feedforward dimension feedforward network model default 2048 dropout dropout value default 01 activation activation function intermediate layer relu gelu default relu example encoder layer nn transformerencoderlayer model 512 nhead 8 src torch rand 10 32 512 encoder layer src
4116,TreeBuilder,Summary,3,1,base treebuilder implementation documentclass class use bottommost node document elementclass class use html element commentclass class use comment doctypeclass class use doctypes
4126,Trie,Summary,3,0,abstract base class try
4128,UndefinedEnvironmentName,Summary,3,1,name attempted used exist inside environment
5681,Unfold,Summary,3,1,extract sliding local block batched input tensor consider batched attr input tensor shape math n c math n batch dimension math c channel dimension math represent arbitrary spatial dimension operation flattens sliding attr kernel size sized block within spatial dimension attr input column ie last dimension 3 attr output tensor shape math n c time prod text kernel size l math c time prod text kernel size total number value within block block math prod text kernel size spatial location containing math c channeled vector math l total number block math l prod left lfloor frac text spatial size 2 time text padding text dilation time text kernel size 1 1 text stride 1 right rfloor math text spatial size formed spatial dimension attr input math math spatial dimension therefore indexing attr output last dimension column dimension give value within certain block attr padding attr stride attr dilation argument specify sliding block retrieved attr stride control stride sliding block attr padding control amount implicit zero padding side attr padding number point dimension reshaping attr dilation control spacing kernel point also known trous algorithm harder describe link nice visualization attr dilation args kernel size int tuple size sliding block stride int tuple optional stride sliding block input spatial dimension default 1 padding int tuple optional implicit zero padding added side input default 0 dilation int tuple optional parameter control stride element within neighborhood default 1 attr kernel size attr dilation attr padding attr stride int tuple length 1 value replicated across spatial dimension case two input spatial dimension operation sometimes called im2col note class torch nn fold calculates combined value resulting large tensor summing value containing block class torch nn unfold extract value local block copying large tensor block overlap inverse general folding unfolding operation related follows consider class torch nn fold class torch nn unfold instance created parameter fold params dict kernel size dilation padding stride fold nn fold output size fold params unfold nn unfold fold params supported input tensor following equality hold fold unfold input divisor input divisor tensor depends shape dtype input input one torch one input shape dtype input dtype divisor fold unfold input one divisor tensor contains zero element fold unfold operation inverse constant divisor input math n c output math n c time prod text kernel size l described example unfold nn unfold kernel size 2 3 input torch randn 2 5 3 4 output unfold input patch contains 30 value 2x3 6 vector 5 channel 4 block 2x3 kernel total 3x4 input output size torch size 2 30 4 convolution equivalent unfold matrix multiplication fold view output shape inp torch randn 1 3 10 12 w torch randn 2 3 4 5 inp unf torch nn functional unfold inp 4 5 unf inp unf transpose 1 2 matmul w view w size 0 1 transpose 1 2 torch nn functional fold unf 7 8 1 1 equivalently avoiding copy unf view 1 2 7 8 torch nn functional conv2d inp w ab max tensor 19073e 06
859,UniqueAnchor,Summary,3,0,model used something model point
4132,UnlockError,Summary,3,0,base class error arising attempt release lock try raise unlockerror except error pas
2351,UnsortedIndexError,Summary,3,0,error raised attempting get slice multiindex index lexsorted subclass keyerror
863,UpdateError,Summary,3,0,occurs django try update session deleted
5890,UploadTaskGroupBuilder,Summary,3,1,simple class upload checkpoint
5892,UseOptimizer,Summary,3,0,context class allow setting current context example usage brew useoptimizer optim brew func useoptimizer weight weight optim brew func useoptimizer default optim bias bias optim weight weight optim brew func brew func useoptimizer optim2 brew func
865,UserCreationForm,Parameters,2,0,form creates user privilege given username password
865,UserCreationForm,Summary,3,0,form creates user privilege given username password
1174,UserMagics,Summary,3,0,placeholder user defined magic added runtime magic eventually merged single namespace runtime use class isolate magic defined dynamically user class
1496,Util,Summary,3,1,utility function build
1500,VCardSet,Summary,3,1,add line vcard ensuring vcard exists
1502,VCardStore,Summary,3,1,disk backed memory collection vcards vcards added collection using add vcard create file card disk using random name vcs add vcards mailpilevcard vcardline fn dude vcardline email evil com mailpilevcard vcardline fn guy vcards looked directly e mail vcs get vcard evil com fn u dude vcs get vcard nosuch email address none true found using search vcs find vcards guy 0 fn u guy card removed using del vcards vcs del vcards vcs get vcard evil com vcs get vcard evil com none true vcs del vcards vcs find vcards guy vcs find vcards guy
871,VariableWrapper,Summary,3,0,adapter class cursor variable prevents wrapped object converted string used instantiate oracleparam used generally object passed cursor execute
1498,Vcard,Summary,3,1,display single vcard
879,WindowFrame,Summary,3,0,model frame clause window expression two type frame clause subclass however processing validation mean intended complete done
890,XFrameOptionsDecoratorsTests,Summary,3,0,test x frame option decorator
893,XFrameOptionsMiddleware,DevelopmentNotes,0,0,set header already set response contains xframe option exempt value set true default set x frame option header sameorigin meaning response loaded frame within site prevent response loaded frame site set x frame option project django setting deny
5923,YellowFinOptimizer,Summary,3,0,yellowfin automatic tuner momentum sgd
1185,YouTubeVideo,Summary,3,0,class embedding youtube video ipython session based video id eg embed video http www youtube com watch v foo would vid youtubevideo foo display vid start 30 second vid youtubevideo abc start 30 display vid calculate second time hour minute second use class datetime timedelta start int timedelta hour 1 minute 46 second 40 total second parameter provided documented http developer google com youtube player parameter parameter converting notebook using nbconvert jpeg representation video inserted document
4142,ZipResourceFinder,Summary,3,1,resource finder resource zip file
2357,_BZ2Proxy,Summary,3,0,small proxy class enables external file object support r bz2 w bz2 mode actually workaround limitation bz2 module bz2file class unlike gzip gzipfile support file object argument
2369,_FileInFile,Summary,3,1,thin wrapper around existing file object provides part data individual file object
1215,_MockPOP3,Summary,3,0,base mock pretend poplib pop3 connection pm pop3mailbox localhost user bad conn cl mockpop3 traceback recent call last accesserror pm pop3mailbox localhost user password b conn cl mockpop3 pm stat 2 123456 pm iterkeys evil good evil pm bogon pm true false msg subject msg pm msg 1 msg 2 pm get msg size evil pm get msg size good 47 51 pm get byte evil test mailpile nsubject msg 1 n noh hi n pm invalid key traceback recent call last keyerror
2375,_MovedItems,Summary,3,0,lazy loading moved object
4144,_OpNamespace,DevelopmentNotes,0,0,op namespace dynamically bind operator python say user created custom operator called namespace op call op user write torch ops namespace op startup operation yet bound python instead following sequence magic trick occur 1 torch ops namespace invoke getattr magic method torch ops object create new opnamespace object called namespace set attribute ops object 2 torch ops namespace op invoke getattr namespace object retrieve operation via torch get operation function bound c similar 3 torch ops namespace op call new operation subsequent access incur lookup namespace operation already exist
4144,_OpNamespace,Summary,3,0,op namespace dynamically bind operator python say user created custom operator called namespace op call op user write torch ops namespace op startup operation yet bound python instead following sequence magic trick occur 1 torch ops namespace invoke getattr magic method torch ops object create new opnamespace object called namespace set attribute ops object 2 torch ops namespace op invoke getattr namespace object retrieve operation via torch get operation function bound c similar 3 torch ops namespace op call new operation subsequent access incur lookup namespace operation already exist
4144,_OpNamespace,Usage,4,0,op namespace dynamically bind operator python say user created custom operator called namespace op call op user write torch ops namespace op startup operation yet bound python instead following sequence magic trick occur 1 torch ops namespace invoke getattr magic method torch ops object create new opnamespace object called namespace set attribute ops object 2 torch ops namespace op invoke getattr namespace object retrieve operation via torch get operation function bound c similar 3 torch ops namespace op call new operation subsequent access incur lookup namespace operation already exist
2377,_PathParents,Summary,3,0,object provides sequence like access logical ancestor path
1042,capture_output,Summary,3,0,context manager capturing stdout err
2816,fdspawn,Summary,3,1,like pexpect spawn allows supply open file descriptor example could use read file looking pattern control modem serial device
3304,omdict,Summary,3,0,ordered multivalue dictionary multivalue dictionary dictionary store multiple value per key ordered multivalue dictionary multivalue dictionary retains order insertion deletion internally item stored doubly linked list self item dictionary self map also maintained store ordered list linked list node reference one value associated key standard dict method interact first value associated given key mean omdict retains method parity dict dict object replaced omdict object interaction behave identically dict method retain parity omdict get setdefault pop popitem clear copy update fromkeys len getitem setitem delitem contains item key value iteritems iterkeys itervalues optional parameter added dict method added parameter optional existing use remains unaffected optional key parameter added method item value iteritems itervalues new method also added omdict method list name interact list value method name interact item dictionary including multiple item key new omdict method load size reverse getlist add addlist set setlist setdefaultlist poplist popvalue popvalues popitem poplistitem allitems allkeys allvalues list listitems iterallitems iterallkeys iterallvalues iterlists iterlistitems
