comment_sentence_id,class,category,category_encoded,partition,processed_text
1548,AbstractEngine,Summary,3,0,object serving base class engine
1550,AbstractHolidayCalendar,Summary,3,1,abstract interface create holiday following certain rule
1,AccessMixin,Summary,3,1,abstract cbv mixin give access mixins customizable functionality
1552,AccessorCallableDocumenter,Summary,3,0,documenter let u remove call method signature callable accessors like series plot
1558,AccessorDocumenter,Summary,3,1,specialized documenter subclass accessors
4212,Adadelta,Summary,3,0,implement adadelta algorithm proposed adadelta adaptive learning rate method argument params iterable iterable parameter optimize dicts defining parameter group rho float optional coefficient used computing running average squared gradient default 09 eps float optional term added denominator improve numerical stability default 1e 6 lr float optional coefficient scale delta applied parameter default 10 weight decay float optional weight decay l2 penalty default 0
4237,Adam,Summary,3,0,implement adam algorithm proposed adam method stochastic optimization argument params iterable iterable parameter optimize dicts defining parameter group lr float optional learning rate default 1e 3 beta tuple float float optional coefficient used computing running average gradient square default 09 0999 eps float optional term added denominator improve numerical stability default 1e 8 weight decay float optional weight decay l2 penalty default 0 amsgrad boolean optional whether use amsgrad variant algorithm paper convergence adam beyond default false adam method stochastic optimization http arxiv org ab 14126980 convergence adam beyond http openreview net forum id ryqu7f rz
4273,Adamax,Summary,3,1,implement adamax algorithm variant adam based infinity norm proposed adam method stochastic optimization argument params iterable iterable parameter optimize dicts defining parameter group lr float optional learning rate default 2e 3 beta tuple float float optional coefficient used computing running average gradient square eps float optional term added denominator improve numerical stability default 1e 8 weight decay float optional weight decay l2 penalty default 0
4296,AdaptiveMaxPool3d,Summary,3,0,applies 3d adaptive max pooling input signal composed several input plane output size x h x w input size number output feature equal number input plane args output size target output size image form x h x w tuple h w single cube x x h w either int none mean size input return index true return index along output useful pas nn maxunpool3d default false example target output size 5x7x9 nn adaptivemaxpool3d 5 7 9 input torch randn 1 64 8 9 10 output input target output size 7x7x7 cube nn adaptivemaxpool3d 7 input torch randn 1 64 10 9 8 output input target output size 7x9x8 input torch randn 1 64 10 9 8 output input
5,AmbiguityError,Summary,3,1,one migration match name prefix
2382,And,DevelopmentNotes,0,0,requires given class parseexpression found given order expression may separated whitespace may constructed using operator may also constructed using operator suppress backtracking example integer word nums name expr oneormore word alpha expr integer id name expr name integer age easily written expr integer id name expr name integer age
7,AppConfigStub,Summary,3,1,stub appconfig provides label dict model
11,Archive,DevelopmentNotes,0,1,external api class encapsulates archive implementation
11,Archive,Summary,3,1,external api class encapsulates archive implementation
14,ArchiveIndexView,Summary,3,1,top level archive date based item
2408,Argument,Summary,3,0,argument positional parameter command generally provide fewer feature option infinite nargs required default parameter passed onwards parameter constructor
16,Atomic,Summary,3,1,guarantee atomic execution given block used decorator call wrap execution decorated function instance used context manager used context manager enter creates transaction savepoint depending whether transaction already progress exit commits transaction release savepoint normal exit roll back transaction savepoint exception possible disable creation savepoints goal ensure code run within transaction without creating overhead stack savepoints identifier maintained attribute connection none denotes absence savepoint allows reentrancy even atomicwrapper reused
50,AtomicTests,Summary,3,1,test atomic decorator context manager test make assertion internal attribute robust way ask database current transaction state since decorator syntax converted context manager see implementation basic test decorator syntax bulk test use context manager syntax
912,Audio,Summary,3,1,create audio object object returned input cell passed display function result audio control displayed frontend work notebook parameter data numpy array list unicode str byte one numpy 1d array containing desired waveform mono numpy 2d array containing waveform channel shape nchan nsamples standard channel order see http msdn microsoft com en u library window hardware dn653308 v v 85 aspx list float integer representing waveform mono string containing filename bytestring containing raw pcm data url pointing file web array option used waveform normalized filename url used format support browser dependent url unicode url download data filename unicode path local file load data embed boolean audio data embedded using data uri true original source referenced set true want audio playable later internet connection notebook default true unless keyword argument url set default value false rate integer sampling rate raw data required data parameter used array autoplay bool set true audio immediately start playing default false normalize bool whether audio normalized rescaled maximum possible range default true set false data must 1 1 inclusive otherwise error raised applies data list array sample type audio never normalized example generate sound import numpy np framerate 44100 np linspace 0 5 framerate 5 data np sin 2 np pi 220 np sin 2 np pi 224 audio data rate framerate also stereo channel dataleft np sin 2 np pi 220 dataright np sin 2 np pi 224 audio dataleft dataright rate framerate audio http www nch com au acm 8k16bitpcm wav url audio url http www w3schools com html horse ogg audio path sound wav file audio filename path sound ogg audio b raw wav data byte audio data b raw wav data
5929,AuthBase,Summary,3,0,base class auth implementation derive
62,AutoFieldMeta,Summary,3,1,metaclass maintain backward inheritance compatibility autofield intended autofieldmixin become public api possible create non integer automatically generated field using column default stored database many area django also relies using isinstance check automatically generated field subclass autofield new flag need implemented field used instead issue addressed metaclass could used deprecate inheritance autofield use isinstance autofield detecting automatically generated field
1265,AutoTlsConnBroker,Summary,3,0,broker try auto upgrade connection use tl least ssl handshake record info
1263,AutocryptSearch,Summary,3,0,search autocrypt database
4460,BCEWithLogitsLoss,Summary,3,0,loss combine sigmoid layer bceloss one single class version numerically stable using plain sigmoid followed bceloss combining operation one layer take advantage log sum exp trick numerical stability unreduced ie attr reduction set none loss described math ell x l l 1 dot l n top quad l n w n left n cdot log sigma x n 1 n cdot log 1 sigma x n right math n batch size attr reduction none default mean math ell x begin case operatorname mean l text reduction text mean operatorname sum l text reduction text sum end case used measuring error reconstruction example auto encoder note target number 0 1 possible trade recall precision adding weight positive example case multi label classification loss described math ell c x l c l 1 c dot l n c top quad l n c w n c left p c n c cdot log sigma x n c 1 n c cdot log 1 sigma x n c right example dataset contains 100 positive 300 negative example single class po weight class equal math frac 300 100 3 loss would act dataset contains math 3 time 100 300 positive example example target torch one 10 64 dtype torch float32 64 class batch size 10 output torch full 10 64 0999 prediction logit po weight torch one 64 weight equal 1 criterion torch nn bcewithlogitsloss po weight po weight criterion output target log sigmoid 0999 tensor 03135 args weight tensor optional manual rescaling weight given loss batch element given tensor size nbatch size average bool optional deprecated see attr reduction default loss averaged loss element batch note loss multiple element per sample field attr size average set false loss instead summed minibatch ignored reduce false default true reduce bool optional deprecated see attr reduction loss averaged summed observation minibatch depending attr size average attr reduce false return loss per batch element instead ignores attr size average default true reduction string optional specifies reduction apply output none mean sum none reduction applied mean sum output divided number element output sum output summed note attr size average attr reduce process deprecated meantime default mean po weight tensor optional weight positive example must vector length equal number class shape input math n math mean number additional dimension target math n shape input output scalar attr reduction none math n example loss nn bcewithlogitsloss input torch randn 3 requires grad true target torch empty 3 random 2 output loss input target output backward
218,BCryptSHA256PasswordHasher,Summary,3,0,secure password hashing using bcrypt algorithm recommended considered many secure algorithm must first install bcrypt library
1642,BYearBegin,Summary,3,0,dateoffset increment business year begin date
84,BadSignature,Summary,3,1,signature match
86,BarAccount,Summary,3,0,service specific account type bar
1560,Base,Summary,3,0,common test variation intervalindex construction input data supplied break format converted subclass method get kwargs break expected format
88,BaseCommand,Summary,3,0,base class management command ultimately derive use class want access mechanism parse command line argument work code call response need change behavior consider using one subclass defined file interested overriding customizing various aspect command parsing execution behavior normal flow work follows 1 django admin manage py load command class call run argv method 2 run argv method call create parser get argumentparser argument parses performs environment change requested option like pythonpath call execute method passing parsed argument 3 execute method attempt carry command calling handle method parsed argument output produced handle printed standard output command intended produce block sql statement wrapped begin commit 4 handle execute raised exception eg commanderror run argv instead print error message stderr thus handle method typically starting point subclass many built command command type either place logic handle perform additional parsing work handle delegate specialized method needed several attribute affect behavior various step along way help short description command printed output transaction boolean indicating whether command output sql statement true output automatically wrapped begin commit default value false requires migration check boolean true command print warning set migration disk match migration database requires system check boolean true entire django project checked error prior executing command validate individual application model rather application model call self check app configs handle app configs list application configuration provided app registry
2418,BaseCommand_,Summary,3,1,cli command
201,BaseDatabaseSchemaEditor,DevelopmentNotes,0,0,class subclass responsible emitting schema changing statement database model creation removal alteration field renaming index fiddling
201,BaseDatabaseSchemaEditor,Summary,3,0,class subclass responsible emitting schema changing statement database model creation removal alteration field renaming index fiddling
210,BaseExpression,Summary,3,0,base class query expression
1569,BaseInterfaceTests,Summary,3,1,test basic interface satisfied interface
4344,BaseTestCase,Summary,3,0,base class used tensorboard test
212,BaseUpdateView,Summary,3,0,base view updating existing object using base class requires subclassing provide response mixin
216,BaseYearArchiveView,Summary,3,0,list object published given year
4346,BatchNorm1d,Summary,3,0,applies batch normalization 2d 3d input mini batch 1d input optional additional channel dimension described paper batch normalization accelerating deep network training reducing internal covariate shift math mean standard deviation calculated per dimension size c c input size also default training layer keep running estimate computed mean variance used normalization evaluation running estimate kept default attr momentum 01 attr track running stats set false layer keep running estimate batch statistic instead used evaluation time well note attr momentum argument different one used optimizer class conventional notion momentum mathematically update rule running statistic math hat x text new 1 text momentum time hat x text momentum time x math hat x estimated statistic math x new observed value batch normalization done c dimension computing statistic n l slice common terminology call temporal batch normalization args num feature math c expected input size math n c l math l input size math n l eps value added denominator numerical stability default 1e 5 momentum value used running mean running var computation set none cumulative moving average ie simple average default 01 affine boolean value set true module learnable affine parameter default true track running stats boolean value set true module track running mean variance set false module track statistic always us batch statistic training eval mode default true shape input math n c math n c l output math n c math n c l shape input example learnable parameter nn batchnorm1d 100 without learnable parameter input torch randn 20 100 output input
1573,BooleanArray,Summary,3,0,array boolean true false data missing value panda extension array boolean data hood represented 2 numpy array boolean array data boolean array mask true indicating missing booleanarray implement kleene logic sometimes called three value logic logical operation see ref boolean kleene construct booleanarray generic array like input use func panda array specifying dtype boolean see example booleanarray considered experimental parameter value numpy ndarray 1 boolean dtype array data mask numpy ndarray 1 boolean dtype array indicating missing value true indicates missing copy bool default false whether copy value mask array attribute none method none return booleanarray example create booleanarray func panda array pd array true false none dtype boolean booleanarray true false na length 3 dtype boolean
227,BoundWidget,Summary,3,0,container class used iterating widget useful widget choice example following used template radio myform beatles label radio id label radio choice label span class radio radio tag span label endfor
2420,BrokenStdoutLoggingError,Summary,3,0,raised brokenpipeerror occurs stdout stream logging
2422,Bucket,Summary,3,0,bucket used store bytecode one template created initialized bytecode cache passed loading function bucket get internal checksum cache assigned use automatically reject outdated cache material
4638,BuildType,Summary,3,1,check build type build type given attr cmake build type env attr cmake build type env none build type inferred cmakecache txt cmakecache txt exist o environ cmake build type used argument cmake build type env str value o environ cmake build type
1638,BusinessHour,Summary,3,0,dateoffset subclass representing possibly n business hour
1640,BusinessMixin,Summary,3,0,mixin business type provide related function
2495,CONSOLE_SCREEN_BUFFER_INFO,Summary,3,0,struct wincon h
249,CacheHandler,Summary,3,0,cache handler manage access cache instance ensure one instance alias exists per thread
4657,Caffe2OperatorTestCase,Summary,3,0,class includes information needed benchmark operator op bench user defined class child caffe2benchmarkbase includes input operator etc test config namedtuple includes test name input shape tag run backward run backward false run forward method executed otherwise run backward method executed
2434,CallBlock,DevelopmentNotes,0,0,like macro without name call instead call called unnamed macro caller argument node hold
1044,CapturingDisplayPublisher,Summary,3,1,displaypublisher store
2440,CaseInsensitiveDict,Summary,3,0,case insensitive dict like object implement method operation mutablemapping well dict copy also provides lower item key expected string structure remembers case last key set iter instance key item iterkeys iteritems contain case sensitive key however querying contains testing case insensitive cid caseinsensitivedict cid accept application json list cid accept true example header content encoding return value content encoding response header regardless header name originally stored constructor update equality comparison operation given key equal lower behavior undefined
1644,CategoricalDtype,Expand,1,1,type categorical data category orderedness parameter category sequence optional must unique must contain null ordered bool none default false whether categorical treated ordered categorical none used maintain ordered value existing categoricals used operation combine categoricals eg astype resolve false existing ordered maintain attribute category ordered method none note class useful specifying type categorical independent value see ref categorical categoricaldtype example pd categoricaldtype category b ordered true pd series b c dtype 12 00 1 b 2 00 3 nan dtype category category 2 object b
1644,CategoricalDtype,Summary,3,0,type categorical data category orderedness parameter category sequence optional must unique must contain null ordered bool none default false whether categorical treated ordered categorical none used maintain ordered value existing categoricals used operation combine categoricals eg astype resolve false existing ordered maintain attribute category ordered method none note class useful specifying type categorical independent value see ref categorical categoricaldtype example pd categoricaldtype category b ordered true pd series b c dtype 12 00 1 b 2 00 3 nan dtype category category 2 object b
1703,CategoricalIndex,Summary,3,0,index based underlying class categorical categoricalindex like categorical take limited also like categorical might order numerical operation addition division possible parameter data array like 1 dimensional value categorical category given value category replaced nan category index like optional category categorical item need unique category given also dtype inferred data ordered bool optional whether categorical treated ordered categorical given dtype resulting categorical unordered dtype categoricaldtype category optional class categoricaldtype cannot used together category ordered versionadded 021 0 copy bool default false make copy input ndarray name object optional name stored index attribute code category ordered method remove unused category set category ordered unordered map category validate explicit ordered true given category note see user guide http panda pydata org panda doc stable user guide advanced html categoricalindex example pd categoricalindex b c b c categoricalindex b c b c category b c ordered false dtype category noqa categoricalindex also instantiated categorical c pd categorical b c b c pd categoricalindex c categoricalindex b c b c category b c ordered false dtype category noqa ordered categoricalindex min max value ci pd categoricalindex b c b c ordered true category c b ci categoricalindex b c b c category c b ordered true dtype category noqa c
1046,CellMagicRole,Summary,3,0,cross reference role displayed prefix
253,Choices,Parameters,2,0,class creating enumerated choice
253,Choices,Summary,3,0,class creating enumerated choice
256,ChunkIter,Summary,3,0,iterable yield chunk data given file like object constructor yield chunk read operation object
262,Client,Summary,3,0,class act client testing purpose allows user compose get post request obtain response server gave request server response object annotated detail context template rendered process serving request client object stateful retain cookie thus session detail lifetime client instance intended replacement twill selenium like allow testing context template produced view rather html rendered end user
2489,ColoredString,Summary,3,0,enhanced string len operation colored output
286,Combinable,Summary,3,0,provide ability combine one two object connector example f foo f bar
2491,CommandError,Summary,3,0,raised error command line argument
1269,ConfigDict,Summary,3,0,sanity checking self documenting dictionary program setting object must initialized dictionary describes structured way variable exist legal value default variable definition expects three value 1 human readable description variable 2 data type sanity check 3 default value sanity check dictionary rule value expected dictionary list item match rule defined used empty list dictionary default value configuration data nested including dictionary rule place default value default value empty list assumed list value type specified example pot configdict rule potato many potato int 0 carrot many carrot int 99 liquid fluid like false water liter int 0 vodka liter int 12 tag tag c c int 0 x x str color color red blue sorted pot key sorted pot value color liquid tag pot potato pot liquid vodka 123 pot potato 123 pot liquid vodka 123 pot carrot 99 pot walk liquid vodka 123 pot walk liquid vodka parent true vodka pot color append red 0 pot color extend blue red red pot color red blue red red 0 pot tag 0 c 123 pot tag append z invalid traceback recent call last valueerror invalid value config tag 1 traceback recent call last invalidkeyerror invalid key config evil traceback recent call last invalidkeyerror invalid key config liquid evil traceback recent call last valueerror invalid value config potato moo traceback recent call last configvalueerror invalid value config color 4 green pot rule potato many potato type int 0 isinstance pot liquid configdict true
1424,ConfigureMailboxes,Summary,3,0,add one mailbox account specified mailbox assigned id use metadata index account specified mailbox assigned account configured automatic indexing
1434,ConnectToGuiOMatic,Summary,3,0,connect waiting gui matic gui
2493,ConnectionError,Summary,3,0,connection error occurred
292,ConsoleDirective,Summary,3,1,restructuredtext directive render two tab code block second tab show window command line equivalent usual unix oriented example
4669,ConstantPad3d,Summary,3,0,pad input tensor boundary constant value n dimensional padding use func torch nn functional pad args padding int tuple size padding int us padding boundary 6 tuple us math text padding left math text padding right math text padding top math text padding bottom math text padding front math text padding back example nn constantpad3d 3 35 input torch randn 16 3 10 20 30 output input using different padding different side nn constantpad3d 3 3 6 6 0 1 35 output input
1436,ContactSet,Summary,3,0,set contact line ensuring contact exists
298,Context,Summary,3,1,stack container variable context
2497,Context_,Summary,3,0,template context hold variable template creating instance neither supported useful created automatically various stage template evaluation created hand context immutable modification attr parent must happen modification attr var allowed generated template code template filter global function marked func contextfunction get active context passed first argument allowed access context read template context support read dict operation get key value item iterkeys itervalues iteritems getitem contains additionally meth resolve method fail keyerror return class undefined object missing variable
